game_id,useful_num,funny_num,user_name,games_owned,reviews_written,recommended,hours_played,review_date,text
531510.0,0,0,76561198832883775,38,1,1,5.1,"30 June, 2019",音樂跟動畫不錯
531510.0,0,0,76561198078696418,77,2,1,4.7,"30 June, 2019",NICE~~~~~~~~~~~~~~
531510.0,0,0,76561198873824053,7,2,1,2.1,"29 June, 2019",很早以前就想買了，比想像中的還要難，開著休閒模式還是卡關在哭哭方塊BOSS戰，鍵盤玩家覺得有點心累...被彈幕撞到會亂飛這點有點影響遊戲體驗，但是音樂真的好聽！
531510.0,0,0,Lan_Xiang,113,3,1,2.6,"29 June, 2019",躲彈幕的音樂遊戲，故事劇情稍短，不過遊戲體驗不錯
534000.0,4,0,tw-deathcat,227,214,1,0.4,"4 October, 2016",這款遊戲比起普遍的站樁射擊遊戲多了定點移動 移動上會放慢動作所以反而不會暈!  (這邊因人而異~)(類似玩onward那種移動時的感覺所以個人反而不會暈)獨特的慢動作和槍彈射擊時來的感覺很特別 很像駭客任務那樣 (要習慣一下)也因為場景關係很像那種港劇裡頭警匪槍戰的片段 優點:-獨特移動方式 比起一般站樁FPS 他這個可以更換角色位置-可以移動時邊移動邊開火射擊也是特色之一-敵方子彈射擊過來時會有點為慢動作的模式感覺像玩駭客任務-難度上不低 敵軍子彈算很多-部分掩體會被打穿打爛! 有臨場感 -敵人也會換子彈動作而不是只是CD-雙槍射擊蠻爽的 -場景上都有做出來 尤其是第二關的室內場景 這邊感覺到蠻多心思的缺點-關卡太少-槍枝太少-耐玩度目前來說普普-說好得多人模式呢?-移動的提示不是很明顯-敵人死掉倒地時有點陽春 類似機台遊戲那樣結束時會給你看射擊命中的位置和準確率 算上一種射擊標靶遊戲!不過目前VR遊戲裡面特別少數的移動模式來說稱得上是佳作!  玩這款請當射擊訓練爽快遊戲看待! 輕度玩家的小品射擊
,5,0,mars_yu_tw,467,31,1,45.6,"2 July, 2017","不錯的小品打hordes射擊塔防遊戲,支援4人co-op模式有武器,技能,建塔與防禦設施,獎勵等....升級看生存者可以活的了幾個夜晚...........遊戲功能整體上還不錯,精彩刺激我目前一人只能獨活到19個夜晚問了開發者,他說這是個無限夜晚的遊戲樂園>_<聽說目前最厲害的玩家已經生存了50個夜晚看來我還有很長的深夜要走下去了...........求戰友一同co-op.....>_<....度過漫漫長夜...挑戰能活存幾夜.....XD建議打折再考慮購入!https://youtu.be/HFwPBprEqZ0"
541230.0,1,0,76561198836495620,5,1,-1,0.7,"25 May, 2019",CANNOT PLAY THIS GAME
541230.0,0,0,378086661,414,253,-1,37.8,"21 January, 2017",起初是玩盗版才知道的。正版打折入手了原本以为盗版卡是破解不好，没想到正版还是经常卡顿而且是超级频繁经常性的卡切换菜单卡，通关后卡，点击PLAY又卡，强化装备又卡游戏很不错，但是还是那么卡而且启动游戏经常不弹出来，每次都要验证完整性一个十几年前的游戏，放在当今年代的电脑，还要读取十几秒，还卡顿，有没有毛病？我为什么买正版呢？心疼我自己
544570.0,4,0,76561198311770581,10,2,1,0.0,"15 February, 2017",怎么安装啊？添加到库中了以后，它一直不自动安装……
547590.0,0,0,76561198307052400,80,6,1,5.6,"3 December, 2016","確實好玩,家裡有好幾台彈珠台真是不錯!但如果能有更多的動畫畫面會更好"
548420.0,1,4,76561198282409882,51,1,-1,0.0,"11 May, 2017",購買惹 請問如何解鎖使用
548420.0,1,0,GermanyTiger,45,11,1,0.0,"6 April, 2017",The Arbiter....black chan use it than i do so
548420.0,0,0,brcmlgh,45,1,1,0.0,"7 January, 2017",so fun
548420.0,0,0,Yamadaxkm300,229,63,1,0.0,"3 January, 2017","新武器(榴彈)感覺還算實用,但只有一個新武器及一堆配件不值得原價入手如果打折時才入手還可以,至少比以前某幾個奇怪武器dlc實用PS:其中一個成就(The Reconing)有Bug做了三次才成功,會讓人有點生氣"
548420.0,0,0,76561198260437587,34,4,1,0.0,"9 December, 2016",非常好玩的遊戲
548420.0,2,3,76561198285874170,15,1,1,0.0,"24 November, 2016",这个pack在哪里啊？我找不到？求助！
552280.0,0,0,76561198260003131,13,1,1,27.1,"21 November, 2019",角砂糖出的遊戲，而且原畫又是萌木原，出中文版實在沒有不支持的道理，不過琥珀也算是滿狠的，一見面就拿出結婚申請書，真白(前作女主角)竟然加碼說不如你們來同居相處一段時間再做決定，連緋文也參一腳說這不是非常好嗎?(然後主角就被迫同居)
552280.0,0,0,76561198238354212,210,18,1,134.1,"2 November, 2019",10/10
552280.0,0,0,76561198321877974,8,2,1,16.0,"19 October, 2019",我在booth下載的補丁，下載完後點進去資料夾裡結果什麼都沒有只有一個文字文件，資料夾檔案大小卻顯示有475MB沒啥問題。解壓縮完更是只有個文字文件而已。請問我該怎麼解決??(花了$$買補丁卻啥都沒有QQ)
552280.0,0,0,LucasLok0520HK,163,48,1,42.0,"26 September, 2019","-----遊戲整體評分:10/10這是我第一次接觸的版本,雖然沒有玩過第1集,但絕對不會不明白故事內容-----畫面評分:10/10畫風優美,角色也是我非常喜愛~-----BGM評分:10/10BGM我也非常喜歡,又不會太單調,已經被我每天播放XD-----故事評分:10/10故事比貓娘還要長很多,可攻略人物主要有3個,3個全通過之後有真白線,有神秘補丁~這故事有血有淚啊...這遊戲已經列入我的最愛=w=""希望有第3集=w=""これは本当に最高のゲームです。私はもうこれゲームを大好きです。夢の中で、こんな少女は大好きですよね。BGMも素晴らしいです！でも、STEAMには、他のVOL.はないけど、残念ですね。"
552280.0,0,0,76561198343338913,7,2,1,44.7,"16 August, 2019",遊戲本身的劇情無論是在份量上還是質量上都屬佳作，但繁中的翻譯真的有點差，有時也會出現一些Bug，不過整體來說還是值得推薦的。
552280.0,0,0,deanarrten,62,2,1,24.1,"30 July, 2019",我必須說這款的故事讓人非常能夠入戲，劇情量多到你無法想像，就算不特價的559買下也一定直得，身為司機雖然有加了R18補丁，不過光是全年齡版的劇情量就像其他評論一樣，超越NEKO%RA1+2+3，小吐槽一下有一些些劇情的不合理，不過不影響整體的體驗，極度推喜歡故事的玩家，想要有點邪念的司機們也一樣喔!!!- - - - -以下有微雷的個人小抱怨- - - - -看了緋文路線30分鐘真的超難過，完全入戲的我只要琥珀啊啊啊啊啊啊啊啊!!!
552280.0,0,0,76561198123733343,30,4,1,10.5,"3 July, 2019",玩過都說讚
552280.0,0,0,76561198407509738,21,13,1,31.9,"30 June, 2019",非常可愛的女主角們，但在h劇情時不夠生動(會動的)，有點可惜，但劇情是不錯的。
552280.0,0,0,76561198967738675,18,1,1,2.0,"29 June, 2019",好玩~~~!
552280.0,0,0,ChiuYui,86,3,1,26.8,"25 June, 2019",方糖社優美的畫風細膩的故事劇情與前作完美銜接的故事內容非常推薦!
552280.0,0,0,76561198133133698,50,11,1,1.8,"13 June, 2019",買了好幾年 現在才開始玩 希望After Stories也能出官中啦不過這人氣可能很難了
552280.0,0,0,76561198802268523,26,3,1,46.9,"5 June, 2019","這真的是好遊戲,真心推薦,劇情清晰又感人,個人線的時候覺得真的這真的很好,尤其是真白線,後面超感動阿,音樂很好聽讓我好想哭..."
552280.0,0,0,76561198137837936,198,141,1,20.7,"3 June, 2019",少數文字遊戲不會讓我玩到常常打哈欠那種目前破完共同線並沒有(虐)地方 很溫暖很安心 人物跟背景清晰度算是很清晰。
552280.0,1,0,zombidjdesu,19,5,1,38.7,"24 May, 2019",琥珀賽高！！琥珀が最高!!Kohaku is the best!!Kohaku ist das Beste!!Kohaku самый лучший!!
552280.0,0,0,AIMATO,298,14,1,8.6,"13 March, 2019",劇情相當[豐滿]配上1000Y的PATCH真香
552280.0,6,0,mnb20319,107,40,1,21.4,"5 March, 2019",相較隔壁棚同樣有耳朵尾巴的エロ糕點師123(NEKOPARA)整整大約是三倍的故事量偏偏最可惜也是讓我生氣的是，錯字砸了個鍋常常都在下麵給大家吃※以下帶雷琥珀線作為第一女主角，其實標準傻白甜浪費了這個好身材.................唯一興趣的緋文線，雖說劇情還真的挺不錯後面突然斗M..................菜乃線雖然有點結局讓我很殘念調教後也走樣..................真白白其實是換個視角再RE一次劇本，但算是補遺各線的小地方（例如打醬油同學）好啦算有創意非NTR，請安心服用，還是說其實我比較期待N.......總之文字量對我來說很大，但是說穿了其實一直圍繞著同一件事情在RE共通線為了塑造與交代人物，長到有點冗好在書籤方式讓各角色人物線進行得比較快-----------------------------------------------------------------------------------文本錯字+常常error（不閃退，只是劇情要重RE，也無法skip）有點不太想好評，但是我支持更多的中文化作品拜託H補釘也順便只能說可惜了
552280.0,0,0,76561198377163185,30,1,1,39.8,"9 February, 2019",AwA   AwA  AwA   AwA　　　　　　　　　　　　　　　　　　　　ＡＷＡ
552280.0,1,0,76561198128306860,339,7,1,61.7,"13 January, 2019",大推不知道有沒有機會玩到中文FD
552280.0,0,0,76561198060985668,334,343,1,4.9,"8 January, 2019","不給好評不能自稱紳士,有補丁就是很棒很棒"
552280.0,1,0,76561198363977221,32,1,1,150.3,"24 December, 2018","整體感受~整體體驗十分良好,不論是在遊戲的音樂使用還是主線內容都比我想像中的還要精彩.特別在琥珀和真白的個人路線上,感情表達非常豐富.精美的繪圖加上聲優的配音令角色感情表達得流漓盡致.在遊戲中多次使用快速播放會出現Error,甚至會引發遊戲崩潰或快速存檔消失.菜乃及緋文個人路線感情過於單薄.優點-在遊戲中設有書籤頁面,令玩家可以隨心所欲隨時隨地跳躍到當中情節.當中特別中設有BGM鑑賞,可以隨時隨地重溫動聽的BGM.文本量豐富,消磨時間一流.多條獨立個人路線,任君選擇.缺點-快速播放會有機會出現Error.翻譯錯字較多."
555120.0,0,0,1143549139,95,24,1,0.0,"9 February, 2018",可不可以告诉我这些图怎么下下来，我都买完了，图呢？？？
555120.0,2,0,shoyameow,58,25,1,0.0,"26 November, 2017",這包是信仰，重覆，這包是信仰！
555120.0,3,6,76561198399602051,61,1,-1,0.0,"29 July, 2017",US$5.99買幾幅圖= =完全無奈
556470.0,0,0,76561198132743326,40,11,1,0.0,"3 July, 2018",生存比本體好玩= =
556470.0,8,0,76561198141560631,459,13,1,0.0,"6 January, 2017",比遊戲本體和地下dlc更值得好玩，像是不同遊戲那樣
559330.0,0,0,loktsang,40,6,1,1.7,"23 January, 2019",強力推薦，很喜歡故事性的內容。
564150.0,0,0,76561198418365653,37,11,1,152.9,"7 October, 2017","優秀的洛克人同人遊戲,這大概是我玩最久的洛克人遊戲"
564150.0,1,1,Strudel0w0,20,2,1,6.9,"7 June, 2017",Rosenkreuzstilette so funny
564150.0,6,0,moezi123,29,3,1,3.5,"14 February, 2017",十年前紅極一時的高質量同人遊戲，仿洛克人的關卡設計及介面加上參考了惡魔城的背景及音樂，假如各位玩家是這兩款遊戲的粉絲的話，相信這一款遊戲會給你無比的樂趣及回憶!但不得不說一下缺點跟建議，這次移植在steam上販售跟十年前的版本相比並沒有做任何的變動，遊玩日本語版的話必須更改系統地區跟Unicode為日文的這個問題依然存在...，否則對話時會停止運行遊戲或顯示亂碼，還有遊戲裡的解析度最高只能支援1280*960，希望未來可以更新支援1920*1080跟修正語系問題，也希望可以增加一些成就來提高耐玩度，應該會更有趣呢~當然續作RKSF有移植過來的話，也會支持並收藏的!!
564150.0,0,0,rokya,45,11,1,6.6,"13 February, 2017",豐富的劇情萌系的人物設定別出心裁的關卡設計絕對是你值得一玩的洛克人系遊戲My favorite megaman style game僕にとって最高のロックマンゲームです充滿誠意的洛克人遊戲!
564150.0,6,0,76561198086992088,29,3,1,3.5,"14 February, 2017",十年前紅極一時的高質量同人遊戲，仿洛克人的關卡設計及介面加上參考了惡魔城的背景及音樂，假如各位玩家是這兩款遊戲的粉絲的話，相信這一款遊戲會給你無比的樂趣及回憶!但不得不說一下缺點跟建議，這次移植在steam上販售跟十年前的版本相比並沒有做任何的變動，遊玩日本語版的話必須更改系統地區跟Unicode為日文的這個問題依然存在...，否則對話時會停止運行遊戲或顯示亂碼，還有遊戲裡的解析度最高只能支援1280*960，希望未來可以更新支援1920*1080跟修正語系問題，也希望可以增加一些成就來提高耐玩度，應該會更有趣呢~當然續作RKSF有移植過來的話，也會支持並收藏的!!
564440.0,29,2,deceso,356,20,-1,0.0,"12 December, 2016","關於此內容可讓『DOA5LR』中登場的角色換上之『AQUAPLUS』合作角色服裝實惠組合。16位角色各1套，共計16套之組合。比單套購入更加划算。■此服裝可破壞。---文案應該是照搬PlayStation Store的上的。然, 服裝並不能破壞  SHAME"
564440.0,29,2,76561198176049563,356,20,-1,0.0,"12 December, 2016","關於此內容可讓『DOA5LR』中登場的角色換上之『AQUAPLUS』合作角色服裝實惠組合。16位角色各1套，共計16套之組合。比單套購入更加划算。■此服裝可破壞。---文案應該是照搬PlayStation Store的上的。然, 服裝並不能破壞  SHAME"
567030.0,0,0,kagurakenmi0911,13,9,1,1.8,"11 November, 2019",很治癒 還不錯適合給孩子玩的小品
567030.0,2,0,max_airaq,214,57,1,0.3,"8 July, 2019",欣賞音樂、比眼力找東西的放鬆式game接近大自然互動比較少
567030.0,2,0,76561198010027796,13,2,1,1.4,"23 February, 2019",畫面漂亮  遊玩方式簡單 以小品遊戲來說大推
567030.0,1,0,76561198845506449,5,1,1,1.1,"6 July, 2018",簡單的小品遊戲，在畫面中尋找隱藏的物品，遊戲方式有點單調，有些物品也很難找到，看得眼都花了。不過畫面和音樂很美，值得慢慢欣賞。
567030.0,5,0,liliummmm,83,13,1,5.0,"2 May, 2017","輕鬆小遊戲,推薦等折扣時候購買"
570840.0,0,0,76561198345518096,5,2,1,11.1,"23 May, 2018",超讚的內容
570840.0,1,0,76561198364665903,1,1,1,6.9,"22 December, 2017",等了好久終於，第一天上市就打穿了!謝謝三隻大貓的陪伴與製作團隊的努力
573130.0,0,0,76561197983461442,60,2,1,13.7,"17 July, 2018",只想說一句，結局不單是只有兩個而是三個。只能說結局設計得真的很有心思。同樣的選擇卻暗示著不一樣的未來！
573130.0,0,0,sorchi_chu_tw,3,39,1,4.2,"1 April, 2018",好遊戲，解謎不難、地圖需要點時間才能看懂，幾乎沒有BUG；不過劇情是圖像呈現，所以有些會不太好理解。好像還有密室可以去看，但要收集很多秘密才能解鎖，有點懶。XD
574310.0,1,0,hitsukirei,96,16,1,2.3,"12 March, 2017",GOOD！！
575510.0,0,0,76561198134640232,85,6,1,7.0,"12 October, 2019",簡單來說就是賣CG和立繪的遊戲，劇情根本虎頭蛇尾。中間講了一堆東西，結果甚麼都沒解釋就進入結局。想看奶子的就等特價時入手(真的不推薦原價入手.......)，想看劇情的就別買了。給推薦是為了Kimiko，因為她很可愛。
575510.0,0,0,76561198364838285,132,13,1,1.3,"25 April, 2018",我TM社保！
577355.0,0,0,76561198004311245,50,60,1,0.0,"16 August, 2018",Very good route
577740.0,0,0,76561198045442152,870,45,-1,0.2,"17 September, 2019",bad view bad control
584980.0,0,0,76561198134395593,63,2,1,7.7,"28 September, 2019",新手攻略:從頭爭論到尾、各種搗亂亂按密碼弄響警報、看女主被捅、接著遇到小混混當然就是要胖揍一頓，最後突然發狂開槍殺死偽善Parr才是大好結局lae04! 爽!
584980.0,1,0,asdgs776,263,18,1,10.7,"6 September, 2019",遊戲內容很用心，幾個結局達成要求比較明顯，難度不大。值得稱道的是一些選項前後的對白和細節的暗示很用心很有誠意，製作組有刻意提示流程，但如果沒有好好注意影片中的環境和對白就會錯過，多玩幾次就會對這些細節會心一笑，例如在醫院出來後去拍賣行，一進門口就會聽到前台在打電話說，奎恩在XX，然後你到了二樓會有人質問誰讓你進來，這時候你的回答是奎恩讓我進來。類似這些對白還有很多很多……所以我是 十分推薦
584980.0,0,0,76561198417036534,107,10,1,0.2,"30 June, 2019",电影不错，互动也很多，算是合集里最好的一部了吧
584980.0,0,0,76561198805669777,127,15,1,10.5,"27 June, 2019",還不錯，但都不能快轉或跳過是挺麻煩的缺點
584980.0,1,0,reluction,135,14,-1,1.3,"24 April, 2019",為為為為何何何何黑屏!!!!!!!??????!!!!!!!我已經重來1X次都黑在同一個地方，非得我要一打開電腦就開遊戲才能繼續能不部布步佈怖能改改改改改BUGGGGGGGGG嗎媽嬤嘛臜蚂?????????拜託了啦啦啦啦啦玩不下去特煩躁
584980.0,0,0,hman2,353,139,1,1.1,"23 April, 2019",下班回家失眠嗎?  這時候你需要打開LATE SHIFT
584980.0,0,0,76561198320051425,1,1,-1,8.8,"18 April, 2019",黑屏+閃退
584980.0,2,0,76561198281882077,39,3,-1,1.5,"16 April, 2019",容易黑屏，玩到選項到時候幾率很大，而且没有跳過選項，黑屏后只能一遍又一遍到看視頻。但遊戲內容不錯，不過我還是要點不推薦，黑屏太影響體驗
584980.0,0,0,76561198002732538,125,28,1,3.8,"21 March, 2019",看到有人介紹看著看著興趣都來了，買來當電影看，但為了要解全部成就要看七次電影會有種倦怠感ＸＤ那個吳先生應該是這劇情中死的最無辜的一個吧．．．
584980.0,0,0,76561198328148029,47,24,1,2.9,"12 February, 2019",代入感強
584980.0,2,0,76561198017410160,471,28,1,3.5,"9 February, 2019","優點很多人都說過了說說缺點....不能跳過看過的影片,我一個失誤就要從頭看影片 到後來真的有點煩不過都出了這麼久 大概也被製作小組給放生了吧"
584980.0,6,0,76561198026541657,307,6,1,2.7,"3 January, 2019",超好玩.強烈推薦.比看電影還好玩.
584980.0,1,0,76561198429444906,68,11,1,5.4,"24 November, 2018",这是一个好玩的游戏花20多看场电影，但剧情太少了
584980.0,5,0,david123445699,412,6,1,8.0,"4 November, 2018",近幾年逐漸掀起新穎的電影模式稱為「互動式電影」，要拍出這類型的電影其實一點也不容易，非常著重編劇流暢度，而這部電影「Late Shift」的編劇是2009年時上映由小勞勃道尼主演「福爾摩斯」(Sherlock Holmes)的編劇之一，這部電影Late Shift的觀眾可以在看電影的過程當中，主角面對一些事情難以抉擇之際，能夠幫他下決定。每一次的抉擇都將影響故事後續劇情的延伸，某些選擇很有可能安全的度過，而些有可能一不小心未來的救命恩人提前陣亡，觀看的過程當中一共有180多種選擇，七種故事結局等待大家去發現。老實說，故事題材不算特別新穎，類似題材電影也很多。但是「Late Shift」最吸引人的地方是多變化的選擇性以及震撼人心的音樂張力，從這個角度就能看出編劇的用心，讓觀眾親身參與其中，並且主宰劇情的走向。開場俯拍的鏡頭，逼格極高的旁白，營造出好萊塢大片的既視感，也讓第一次體驗的我耳目一新。若喜歡體驗劇情的觀眾不妨尋找三五兩友一起觀賞這部電影，那我會非常推薦(Late Shift)這部強調「劇情會隨著觀眾的選擇而改變」的電影。
584980.0,1,0,76561198120316472,34,1,-1,1.1,"13 September, 2018",ulgy ♥♥♥♥♥ cchinese girl place the main role are u serious
584980.0,0,0,76561198357696456,150,58,1,6.8,"30 August, 2018",好游戏，流程有点短，但这个价格也就不奢求什么了。演技爆表，演的很用心，全价都值!
584980.0,0,0,76561198357863354,71,35,1,3.7,"7 August, 2018",一切都是命運的選擇 音樂很燃 故事好像有點短 裡面的男生都好帥 尤其是男主XD這個價錢我給100分 就喜歡玩這種遊戲
584980.0,0,0,76561198016716535,51,8,1,2.2,"11 May, 2018",很特別的遊戲，可惜不能快轉，看重複的畫面花太多時間，讓人缺乏動力
584980.0,1,0,76561198283049823,80,1,1,4.7,"11 March, 2018",声音问题怎么解决谁知道啊
584980.0,0,0,ShaoShuai89,142,36,-1,3.7,"22 February, 2018",不能存档，不能跳过剧情。制作组脑子有病。
585840.0,0,0,76561198875916954,2,4,-1,0.9,"25 July, 2019",玩起來頭很暈畫面不順還很多地方破圖（人物跟石頭都是黑色的）對話內容無聊又浪費看風景不如自己出門走走
585840.0,23,0,coolcoolwei,826,115,1,3.3,"6 January, 2018",在即將離開熟悉的地方時，你會想做些什麼？流程很短的的故事，講述了一位女孩踏上旅程的前夕，與故鄉告別的短篇小品離別一直是很觸動人心的事，特別是一段不知道能不能平安回來的探險這種的離別顯得更加的難過、無奈遊戲在交談上沒有使用太多的情緒用語與冗長的對話卻能深刻的感受到每個人對這趟旅程的看法，有人生氣、有人不解，當然也有人不捨寂靜的桃花源，在西沉的太陽襯托下，成功的營造出了哀傷的氛圍http://steamcommunity.com/sharedfiles/filedetails/?id=1260831189http://steamcommunity.com/sharedfiles/filedetails/?id=1260834144除了故事以外，如詩如畫的風景也可以說是一大賣點本作的光影效果處理的非常好，每個景色都不馬虎隨手一拍都能當明信片人生的旅途永遠都在重新開始與結束每一段旅途也不見得能得到所有人的祝福這遊戲特別適合離鄉背井的游子細細咀嚼或許下一次揚帆啟航之時，能夠和身邊的親友們好好的「道別」說說自己心中最想講、最希望被理解的那部分最後願天下所有在外努力的人們能平安順利的凱旋歸來！http://steamcommunity.com/sharedfiles/filedetails/?id=1260831013
585840.0,1,0,seamlik,199,232,1,0.7,"13 June, 2017",溫馨的故事，衹是太短了。不過這價位也差不多了。通過對話以及場景元素，也可以瞭解到不少背景故事。
585840.0,5,1,76561198072343044,164,32,1,1.1,"15 April, 2017",這篇遊戲內容很短，但你會得到一堆桌布=w=畫面實在太精美了，聲音光影都太棒了
585840.0,3,0,NTOU-pedro,780,31,1,1.3,"13 April, 2017","遊戲很無聊很短,但是輕鬆解完全部成就,有內建簡體中文"
585840.0,0,0,76561198143426649,19,1,1,1.0,"14 February, 2017",極具穿透力的背景音樂，搭配如詩如畫的風景遊戲時間雖然不長，但仍然不失為一款佳作遊戲背後的寓意值得深思
586200.0,0,0,76561198348027001,150,31,1,3.0,"29 June, 2019",光快打1那份情懷與感動就值這個價
586200.0,0,0,76561198065542203,67,1,-1,19.3,"6 June, 2019",垃圾連線，BUG也不修正，騙完錢就就完全不理，千萬不要買!!!!!!!!!!!!!
586200.0,1,9,76561198379878477,217,4,-1,1.5,"5 January, 2019",垃圾游戏，还变相支持港独
586200.0,0,0,76561198847934372,3,3,1,140.1,"3 September, 2018",讚
586200.0,3,1,god_voice,113,6,1,64.6,"15 July, 2018",懷舊用網路上的大家都很強排名戰是贏一次十分 輸一次扣五分 扣到零為止白帶變黃帶是155分左右最後的藍帶成就要1000多分網路的大家都很強呀追加高段的打低段 得的分數會比較少低段的打高段 得的分數會比較多有時高段打低段三戰兩勝 感覺做白工
586200.0,0,0,76561198016425806,8,1,-1,0.4,"13 July, 2018",If the online mode havent slove the lag problem ! wont recommend people to buy it ! Laggy problem still exit ! and pretty bad !
586200.0,1,1,76561198095361353,7,1,-1,42.0,"29 June, 2018","No good. Why so laggy when playing online Super Street Fighter 2 Turbo? The delay was like 2 secs, i could not react to dodge and make attacks effectively at all.  And Street Fighter ALpha 2 why cannot play online ? Only ALpha 3 can online..."
586200.0,0,0,76561198005996502,150,3,1,1.3,"3 June, 2018",快打迷可以買來收藏 如果可以一代也線上對戰就更好
586200.0,8,2,76561198259198168,169,6,-1,0.2,"2 June, 2018",搖桿和遊戲適應有問題，左右斜上斜下輸入無法對應，只有上下左右動作。
586200.0,0,0,jpmonitor,92,5,1,11.2,"30 May, 2018",如果有HYPER Street Fighter II Anniversary 和更多濾鏡選擇會更好
586200.0,0,0,khpoon,187,3,-1,1.0,"30 May, 2018",where is the street fighter iv ?? i don't receive yet Did anyone same as me ??
586200.0,13,6,76561198052521303,29,6,-1,17.2,"29 May, 2018",為什麼我畫面都全黑的 在選角對戰都是?任何一款都是(我自己本身是有SFA2日本版而且能玩 但是30周年紀念的卻黑畫面 三小)這遊戲電腦配備要夠好才能玩?操你媽的 我連 巫師3 超級快打4 都能玩了 為啥這不能玩 幹 而且預購送的還不是終極快打旋風4 是送超級快打旋風4明明說是送終極快打旋風4 都6/1了幹你良勒是什麼時候才要釋出更新啦鄵   虧我小時候還這麼喜歡卡普空 6/2 官方解決方法我都試過了 一樣黑畫面6/29更新後一樣黑畫面
